<?xml version="1.0" encoding="UTF-8"?>
<agenda xmlns:xsi="http://www.w3.org/2001/XMLSchemainstance"
    xsi:noNamespaceSchemaLocation="ex8.xsd">
    <contacto>
        <nombre>Ayuntamiento</nombre>
        <telefonoFijo>010</telefonoFijo>
        <telefonoMovil></telefonoMovil>
    </contacto>
    <contacto>
        <nombre>Emergencias</nombre>
        <telefonoFijo>112 (Uni√≥n Europea)</telefonoFijo>
        <telefonoFijo>911 (Estados Unidos)</telefonoFijo>
        <telefonoMovil>Desconocido</telefonoMovil>
    </contacto>
</agenda>